Program Name,Latitude,Longitude,Participants,Farmers,AIP Stage,More Information
"AIP2ASC ASTIN – East Java, Indonesia",-7.694098,113.936035,"Yayasan Sustainaqua Indonesia (YSAI), ThinkAqua, PT. Bumi Menara Internusa (BMI),PT. Sekar Bumi, Farmers",3 Farmers,Stage 4 – Improvements in Aquaculture Management,https://aipdirectory.org/aip/aip2asc-astin-east-java-indonesia/
"AIP2BP ASTIN – East Java, Indonesia",-7.71062,114.123675,"Yayasan Sustainaqua Indonesia (YSAI), ASTIN Group, ThinkAqua",12 Farmers,Stage 3 – AIP Implementation,https://aipdirectory.org/aip/aip2bp-astin/
"ATINA-ASIC Sidoarjo AIP (East Java, Indonesia)",-7.438542,112.794128,"PT ATINA, ASIC, Badan Metrologi dan Geofisika (Meteorology, Climatology, and Geophysics Council), Balai Besar Perikanan Budidaya Air Payau – Jepara (Jepara Brackishwater Aquaculture Fishery Center), Balai Perikanan Budidaya Air Payau – Takalar (Takalar Brackishwater Aquaculture Fishery Center), Dinas Perikanan Kabupaten Sidoarjo (Fisheries Service of Sidoarjo District), Dinas Perikanan Jawa Timur (Department of Maritime Affairs and Fisheries Prov. East Java), Universitas Airlangga (UNIAR) – Surabaya, Farmers",92 Farmers,Stage 4 – Improvements in Aquaculture Management,https://aipdirectory.org/aip/east-java-pt-atina-sidoarjo-ecoshrimp-aip/
"Shrimp Improvement Program (SIP) – East Java, Indonesia",-8.374202,114.346827,"Conservation International, Yayasan Konservasi Indonesia, ThinkAqua, Yayasan Sinergi Akuakultur Indonesia, Banyuwangi Regency, Ministry of Marine Affairs and Fisheries Indonesia, Shrimp Club of Indonesia Banyuwangi branch, Farmers",170 Farmers,Stage 4 – Improvements in Aquaculture Management,https://aipdirectory.org/aip/shrimp-east-java/
ATINA-ASIC South Sulawesi AIP (South Sulawesi Indonesia),-3.881039,119.532807,"Badan Metrologi dan Geofisika (Meteorology, Climatology and Geophysics Council), Balai Besar Perikanan Budidaya Air Payau – Jepara (Jepara Brackishwater Aquaculture Fishery Center), Balai Perikanan Budidaya Air Payau – Takalar (Takalar Brackishwater Aquaculture Fishery Center), Dinas Perikanan Kabupaten Pinrang (Fisheries Service of Pinrang District), Dinas Perikanan Sulawesi Selatan (Department of Maritime Affairs and Fisheries Prov. South Sulawesi), Local cooperatives , Three hatcheries/nursery, Two local brokers, University Hasanuddin Makassar (UNHAS) – Makassar, Farmers",638 Farmers,Stage 4 – Improvements in Aquaculture Management,https://aipdirectory.org/aip/south-sulawesi-asic-ecoshrimp/
